{"components":[{"artifact_digest":"cccccccccccccccccccccccccccccccccccccccccccccccccccccccccccccccc","component":"core-wrap32","slot":"linear-0.kernel","version":"1"},{"artifact_digest":"bbbbbbbbbbbbbbbbbbbbbbbbbbbbbbbbbbbbbbbbbbbbbbbbbbbbbbbbbbbbbbbb","component":"masked-linear","slot":"linear-0.method","version":"1"}],"conversions":[],"evidence_references":[{"digest":"75618d145fe93a7ecdd56bcb7e53a64eb4904ace2d0915946823d8c5b87376ef","id":"assurance.composition"}],"logical_plan_digest":"2af9881d478e537177d8ab84637327ee454cc7c7a71a213fc03b01ea2b488703","material_requests":[{"digest":"8888888888888888888888888888888888888888888888888888888888888888","id":"material.mask"}],"resource_forecast":{"digest":"9999999999999999999999999999999999999999999999999999999999999999","id":"resources.fixture"},"role_plans":[{"digest":"dddddddddddddddddddddddddddddddddddddddddddddddddddddddddddddddd","role":"client"},{"digest":"d1ebbf7de7da674a5c6ef30809581f147430a498412d6e96c7ce7144724d969d","role":"inference"},{"digest":"eeeeeeeeeeeeeeeeeeeeeeeeeeeeeeeeeeeeeeeeeeeeeeeeeeeeeeeeeeeeeeee","role":"preparation"}],"schema_version":"pllm.execution_plan.v1","target":{"digest":"7777777777777777777777777777777777777777777777777777777777777777","id":"target.cpu"}}